{
  "id": "a",
  "letra": "A",
  "nome": "[Nome do candidato A]",
  "status": "exemplo",
  "cobertura": {
    "Saúde": {
      "consta": true,
      "revisado": false
    },
    "Educação": {
      "consta": true,
      "revisado": false
    },
    "Segurança": {
      "consta": true,
      "revisado": false
    },
    "Economia": {
      "consta": true,
      "revisado": false
    },
    "Emprego e renda": {
      "consta": true,
      "revisado": false
    },
    "Aposentados e previdência": {
      "consta": true,
      "revisado": false
    },
    "Meio ambiente": {
      "consta": true,
      "revisado": false
    },
    "Moradia": {
      "consta": true,
      "revisado": false
    },
    "Cultura e esporte": {
      "consta": false,
      "revisado": false
    }
  },
  "propostas": [
    {
      "id": "saude-01",
      "area": "Saúde",
      "titulo": "[Exemplo: proposta 1 de Saúde]",
      "resumo": "[Exemplo: resumo em linguagem simples, começando com 'propõe']",
      "trecho_original": "[Exemplo: trecho literal do plano]",
      "pagina": 0,
      "link_pdf": "https://divulgacandcontas.tse.jus.br/"
    },
    {
      "id": "saude-02",
      "area": "Saúde",
      "titulo": "[Exemplo: proposta 2 de Saúde]",
      "resumo": "[Exemplo: resumo em linguagem simples, começando com 'propõe']",
      "trecho_original": "[Exemplo: trecho literal do plano]",
      "pagina": 0,
      "link_pdf": "https://divulgacandcontas.tse.jus.br/"
    },
    {
      "id": "educacao-01",
      "area": "Educação",
      "titulo": "[Exemplo: proposta 1 de Educação]",
      "resumo": "[Exemplo: resumo em linguagem simples, começando com 'propõe']",
      "trecho_original": "[Exemplo: trecho literal do plano]",
      "pagina": 0,
      "link_pdf": "https://divulgacandcontas.tse.jus.br/"
    },
    {
      "id": "educacao-02",
      "area": "Educação",
      "titulo": "[Exemplo: proposta 2 de Educação]",
      "resumo": "[Exemplo: resumo em linguagem simples, começando com 'propõe']",
      "trecho_original": "[Exemplo: trecho literal do plano]",
      "pagina": 0,
      "link_pdf": "https://divulgacandcontas.tse.jus.br/"
    },
    {
      "id": "seguranca-01",
      "area": "Segurança",
      "titulo": "[Exemplo: proposta 1 de Segurança]",
      "resumo": "[Exemplo: resumo em linguagem simples, começando com 'propõe']",
      "trecho_original": "[Exemplo: trecho literal do plano]",
      "pagina": 0,
      "link_pdf": "https://divulgacandcontas.tse.jus.br/"
    },
    {
      "id": "seguranca-02",
      "area": "Segurança",
      "titulo": "[Exemplo: proposta 2 de Segurança]",
      "resumo": "[Exemplo: resumo em linguagem simples, começando com 'propõe']",
      "trecho_original": "[Exemplo: trecho literal do plano]",
      "pagina": 0,
      "link_pdf": "https://divulgacandcontas.tse.jus.br/"
    },
    {
      "id": "economia-01",
      "area": "Economia",
      "titulo": "[Exemplo: proposta 1 de Economia]",
      "resumo": "[Exemplo: resumo em linguagem simples, começando com 'propõe']",
      "trecho_original": "[Exemplo: trecho literal do plano]",
      "pagina": 0,
      "link_pdf": "https://divulgacandcontas.tse.jus.br/"
    },
    {
      "id": "economia-02",
      "area": "Economia",
      "titulo": "[Exemplo: proposta 2 de Economia]",
      "resumo": "[Exemplo: resumo em linguagem simples, começando com 'propõe']",
      "trecho_original": "[Exemplo: trecho literal do plano]",
      "pagina": 0,
      "link_pdf": "https://divulgacandcontas.tse.jus.br/"
    },
    {
      "id": "emprego-e-renda-01",
      "area": "Emprego e renda",
      "titulo": "[Exemplo: proposta 1 de Emprego e renda]",
      "resumo": "[Exemplo: resumo em linguagem simples, começando com 'propõe']",
      "trecho_original": "[Exemplo: trecho literal do plano]",
      "pagina": 0,
      "link_pdf": "https://divulgacandcontas.tse.jus.br/"
    },
    {
      "id": "emprego-e-renda-02",
      "area": "Emprego e renda",
      "titulo": "[Exemplo: proposta 2 de Emprego e renda]",
      "resumo": "[Exemplo: resumo em linguagem simples, começando com 'propõe']",
      "trecho_original": "[Exemplo: trecho literal do plano]",
      "pagina": 0,
      "link_pdf": "https://divulgacandcontas.tse.jus.br/"
    },
    {
      "id": "meio-ambiente-01",
      "area": "Meio ambiente",
      "titulo": "[Exemplo: proposta 1 de Meio ambiente]",
      "resumo": "[Exemplo: resumo em linguagem simples, começando com 'propõe']",
      "trecho_original": "[Exemplo: trecho literal do plano]",
      "pagina": 0,
      "link_pdf": "https://divulgacandcontas.tse.jus.br/"
    },
    {
      "id": "meio-ambiente-02",
      "area": "Meio ambiente",
      "titulo": "[Exemplo: proposta 2 de Meio ambiente]",
      "resumo": "[Exemplo: resumo em linguagem simples, começando com 'propõe']",
      "trecho_original": "[Exemplo: trecho literal do plano]",
      "pagina": 0,
      "link_pdf": "https://divulgacandcontas.tse.jus.br/"
    },
    {
      "id": "moradia-01",
      "area": "Moradia",
      "titulo": "[Exemplo: proposta 1 de Moradia]",
      "resumo": "[Exemplo: resumo em linguagem simples, começando com 'propõe']",
      "trecho_original": "[Exemplo: trecho literal do plano]",
      "pagina": 0,
      "link_pdf": "https://divulgacandcontas.tse.jus.br/"
    },
    {
      "id": "moradia-02",
      "area": "Moradia",
      "titulo": "[Exemplo: proposta 2 de Moradia]",
      "resumo": "[Exemplo: resumo em linguagem simples, começando com 'propõe']",
      "trecho_original": "[Exemplo: trecho literal do plano]",
      "pagina": 0,
      "link_pdf": "https://divulgacandcontas.tse.jus.br/"
    },
    {
      "id": "aposentados-e-previdencia-01",
      "area": "Aposentados e previdência",
      "titulo": "[Exemplo: proposta 1 de Aposentados e previdência]",
      "resumo": "[Exemplo: resumo em linguagem simples, começando com 'propõe']",
      "trecho_original": "[Exemplo: trecho literal do plano]",
      "pagina": 0,
      "link_pdf": "https://divulgacandcontas.tse.jus.br/"
    },
    {
      "id": "aposentados-e-previdencia-02",
      "area": "Aposentados e previdência",
      "titulo": "[Exemplo: proposta 2 de Aposentados e previdência]",
      "resumo": "[Exemplo: resumo em linguagem simples, começando com 'propõe']",
      "trecho_original": "[Exemplo: trecho literal do plano]",
      "pagina": 0,
      "link_pdf": "https://divulgacandcontas.tse.jus.br/"
    }
  ]
}
